{
  "track": "A_card9",
  "status": "NUMERICAL_EVIDENCE",
  "headline": "CARD9 solver is repository-portable and phase-replays saved rejections, but no exact closure certificate exists.",
  "dependencies": [
    "Continue sparse Benders search beyond bounded smoke test",
    "Produce optimizer-free exact certificate or phase-feasible witness",
    "Track E audit helper derivation and generated nogoods"
  ],
  "artifacts": [
    "agents/A_card9/RESULT.md",
    "agents/A_card9/verify_repo_relative.py",
    "artifacts/current_state/EONLY_PHASE_BENDERS.json",
    "artifacts/current_state/CARD9_SPARSE_EXACT_RECORDS.json"
  ],
  "next_action": "Continue the repository-relative CARD9 search while preserving exact replay inputs and refusing timeout-as-infeasible conclusions."
}
